{
  "distribution": {
    "binnings": [
      {
        "bin_rule": "left-closed-right-open-last-closed",
        "domain": {
          "kind": "full"
        },
        "edges": [
          0.10000000149011612,
          2.4750000489875674,
          4.850000096485019,
          7.22500014398247,
          9.600000191479921,
          11.975000238977373,
          14.350000286474824,
          16.725000333972275,
          19.100000381469727
        ],
        "global_counts": [
          24,
          24,
          24,
          23,
          24,
          24,
          24,
          24
        ],
        "global_overflow_count": 0,
        "global_underflow_count": 0,
        "id": "linear-full",
        "scale": {
          "kind": "linear"
        }
      },
      {
        "bin_rule": "left-closed-right-open-last-closed",
        "domain": {
          "bounds": [
            1.0,
            18.0
          ],
          "kind": "focused"
        },
        "edges": [
          1.0,
          3.125,
          5.25,
          7.375,
          9.5,
          11.625,
          13.75,
          15.875,
          18.0
        ],
        "global_counts": [
          22,
          21,
          21,
          21,
          22,
          21,
          21,
          22
        ],
        "global_overflow_count": 11,
        "global_underflow_count": 9,
        "id": "linear-focused",
        "scale": {
          "kind": "linear"
        }
      },
      {
        "bin_rule": "left-closed-right-open-last-closed",
        "domain": {
          "kind": "full"
        },
        "edges": [
          0.10000000149011612,
          0.19280983263668547,
          0.37175631007426596,
          0.716782708589615,
          1.3820275202065229,
          2.664684908996232,
          5.137774436771845,
          9.906134145177303,
          19.100000381469727
        ],
        "global_counts": [
          1,
          2,
          4,
          6,
          13,
          25,
          48,
          92
        ],
        "global_overflow_count": 0,
        "global_underflow_count": 0,
        "id": "log-full",
        "scale": {
          "kind": "log"
        }
      },
      {
        "bin_rule": "left-closed-right-open-last-closed",
        "domain": {
          "bounds": [
            1.0,
            18.0
          ],
          "kind": "focused"
        },
        "edges": [
          1.0,
          1.4351888878844894,
          2.0597671439071177,
          2.9561549165650676,
          4.242640687119285,
          6.088990769440214,
          8.738851890731821,
          12.541903126446668,
          18.0
        ],
        "global_counts": [
          5,
          6,
          9,
          13,
          18,
          27,
          38,
          55
        ],
        "global_overflow_count": 11,
        "global_underflow_count": 9,
        "id": "log-focused",
        "scale": {
          "kind": "log"
        }
      },
      {
        "bin_rule": "left-closed-right-open-last-closed",
        "domain": {
          "kind": "full"
        },
        "edges": [
          0.10000000149011612,
          0.5816781248958551,
          1.2742778976228457,
          2.270159632482975,
          3.7021272260082503,
          5.761137967072362,
          8.721767279486023,
          12.97882420041933,
          19.100000381469727
        ],
        "global_counts": [
          5,
          7,
          10,
          15,
          20,
          30,
          42,
          62
        ],
        "global_overflow_count": 0,
        "global_underflow_count": 0,
        "id": "symlog-full",
        "scale": {
          "kind": "symlog",
          "linear_threshold": 1.0
        }
      },
      {
        "bin_rule": "left-closed-right-open-last-closed",
        "domain": {
          "bounds": [
            1.0,
            18.0
          ],
          "kind": "focused"
        },
        "edges": [
          1.0,
          1.6499973907784942,
          2.5112430855664143,
          3.6523925075700134,
          5.164414002968977,
          7.167840511773099,
          9.822378022246797,
          13.33963676048627,
          18.0
        ],
        "global_counts": [
          7,
          9,
          11,
          15,
          20,
          27,
          35,
          47
        ],
        "global_overflow_count": 11,
        "global_underflow_count": 9,
        "id": "symlog-focused",
        "scale": {
          "kind": "symlog",
          "linear_threshold": 1.0
        }
      }
    ]
  },
  "format": "ephys-atlas-volume-summary-v1",
  "grid_id": "golden-grid-25um",
  "grid_shape": [
    8,
    6,
    4
  ],
  "missing_voxel_count": 1,
  "outside_voxel_count": 0,
  "schema_version": "1.0",
  "total_voxel_count": 192,
  "valid_statistics": {
    "max": 19.100000381469727,
    "mean": 9.600000002114248,
    "median": 9.600000381469727,
    "min": 0.10000000149011612,
    "q05": 1.050000011920929,
    "q25": 4.8500001430511475,
    "q75": 14.349999904632568,
    "q95": 18.15000057220459,
    "std": 5.513619501968787
  },
  "valid_voxel_count": 191
}
